{
  "version": 1,
  "name": "Built-in",
  "contentHash": "545b07cd192104ea3dbad21ec000c4658c88334d805e06e378ade49a9085b0c3",
  "services": [
    "ios:browser",
    "ios:calendar",
    "ios:contacts",
    "ios:files",
    "ios:location",
    "ios:messages",
    "ios:notifications",
    "ios:reminders",
    "mcp:aws",
    "web:amazon.com",
    "web:americanexpress.com",
    "web:appstoreconnect.apple.com",
    "web:archive.ph",
    "web:blueprint.bryanjohnson.com",
    "web:chase.com",
    "web:clinicaltrials.gov",
    "web:creator.xiaohongshu.com",
    "web:ctrip.com",
    "web:dailymed.nlm.nih.gov",
    "web:developer.apple.com",
    "web:en.wikipedia.org",
    "web:frontierdermpartners.modmedapp.com",
    "web:github.com",
    "web:google.com",
    "web:huggingface.co",
    "web:instagram.com",
    "web:job-boards.greenhouse.io",
    "web:linkedin.com",
    "web:mail.google.com",
    "web:matchatennis.com",
    "web:mixpanel.com",
    "web:mp.weixin.qq.com",
    "web:my.pacificsciencecenter.org",
    "web:news.ycombinator.com",
    "web:oftendining.com",
    "web:ourworldindata.org",
    "web:secure.bankofamerica.com",
    "web:secure.chase.com",
    "web:taobao.com",
    "web:www.1point3acres.com",
    "web:www.airbnb.com",
    "web:www.chictr.org.cn",
    "web:www.doordash.com",
    "web:www.facebook.com",
    "web:www.fda.gov",
    "web:www.flightaware.com",
    "web:www.google.com",
    "web:www.inhousepharmacy.vu",
    "web:www.namecheap.com",
    "web:www.nature.com",
    "web:www.ncbi.nlm.nih.gov",
    "web:www.nejm.org",
    "web:www.perplexity.ai",
    "web:www.qbitai.com",
    "web:www.skinceuticals.com",
    "web:www.uscis.gov",
    "web:www.usta.com",
    "web:www.usvisascheduling.com",
    "web:x.com",
    "web:xiaohongshu.com"
  ]
}
